{
  "schema": "windshare/fsa-small-file-workload/v1",
  "contentAlgorithm": "windshare/ordinal-offset-mod251/v1",
  "facts": {
    "fileCount": 582,
    "directoryCount": 105,
    "totalBytes": 6762858,
    "emptyFileCount": 31,
    "medianFileSizeBytes": 3961,
    "atMost16KiBCount": 478,
    "atMost64KiBCount": 568,
    "maximumFileSizeBytes": 121863,
    "maximumDirectoryDepth": 8
  },
  "digests": {
    "pathsSha256": "4d9b005fecc732209b17416d08f5910271a21b1ad94d6ba9eba4142ef6c90d21",
    "sizesSha256": "9db21ebc733e40a31acf2f0eff951a6bea19e4b7331ea4e77ffff834fd571d39",
    "contentsSha256": "b2ec0119b896076ce016095302ea4e6b319110c8e1072b53369c38ba04c3c2d2"
  },
  "directories": [
    "d000",
    "d000/d001",
    "d000/d001/d002",
    "d000/d001/d002/d003",
    "d000/d001/d002/d003/d004",
    "d000/d001/d002/d003/d004/d005",
    "d000/d001/d002/d003/d004/d005/d006",
    "d000/d001/d002/d003/d004/d005/d006/d007",
    "d000/d008",
    "d000/d001/d009",
    "d000/d001/d002/d010",
    "d000/d001/d002/d003/d011",
    "d000/d001/d002/d003/d004/d012",
    "d000/d001/d002/d003/d004/d005/d013",
    "d000/d001/d002/d003/d004/d005/d006/d014",
    "d000/d015",
    "d000/d001/d016",
    "d000/d001/d002/d017",
    "d000/d001/d002/d003/d018",
    "d000/d001/d002/d003/d004/d019",
    "d000/d001/d002/d003/d004/d005/d020",
    "d000/d001/d002/d003/d004/d005/d006/d021",
    "d000/d022",
    "d000/d001/d023",
    "d000/d001/d002/d024",
    "d000/d001/d002/d003/d025",
    "d000/d001/d002/d003/d004/d026",
    "d000/d001/d002/d003/d004/d005/d027",
    "d000/d001/d002/d003/d004/d005/d006/d028",
    "d000/d029",
    "d000/d001/d030",
    "d000/d001/d002/d031",
    "d000/d001/d002/d003/d032",
    "d000/d001/d002/d003/d004/d033",
    "d000/d001/d002/d003/d004/d005/d034",
    "d000/d001/d002/d003/d004/d005/d006/d035",
    "d000/d036",
    "d000/d001/d037",
    "d000/d001/d002/d038",
    "d000/d001/d002/d003/d039",
    "d000/d001/d002/d003/d004/d040",
    "d000/d001/d002/d003/d004/d005/d041",
    "d000/d001/d002/d003/d004/d005/d006/d042",
    "d000/d043",
    "d000/d001/d044",
    "d000/d001/d002/d045",
    "d000/d001/d002/d003/d046",
    "d000/d001/d002/d003/d004/d047",
    "d000/d001/d002/d003/d004/d005/d048",
    "d000/d001/d002/d003/d004/d005/d006/d049",
    "d000/d050",
    "d000/d001/d051",
    "d000/d001/d002/d052",
    "d000/d001/d002/d003/d053",
    "d000/d001/d002/d003/d004/d054",
    "d000/d001/d002/d003/d004/d005/d055",
    "d000/d001/d002/d003/d004/d005/d006/d056",
    "d000/d057",
    "d000/d001/d058",
    "d000/d001/d002/d059",
    "d000/d001/d002/d003/d060",
    "d000/d001/d002/d003/d004/d061",
    "d000/d001/d002/d003/d004/d005/d062",
    "d000/d001/d002/d003/d004/d005/d006/d063",
    "d000/d064",
    "d000/d001/d065",
    "d000/d001/d002/d066",
    "d000/d001/d002/d003/d067",
    "d000/d001/d002/d003/d004/d068",
    "d000/d001/d002/d003/d004/d005/d069",
    "d000/d001/d002/d003/d004/d005/d006/d070",
    "d000/d071",
    "d000/d001/d072",
    "d000/d001/d002/d073",
    "d000/d001/d002/d003/d074",
    "d000/d001/d002/d003/d004/d075",
    "d000/d001/d002/d003/d004/d005/d076",
    "d000/d001/d002/d003/d004/d005/d006/d077",
    "d000/d078",
    "d000/d001/d079",
    "d000/d001/d002/d080",
    "d000/d001/d002/d003/d081",
    "d000/d001/d002/d003/d004/d082",
    "d000/d001/d002/d003/d004/d005/d083",
    "d000/d001/d002/d003/d004/d005/d006/d084",
    "d000/d085",
    "d000/d001/d086",
    "d000/d001/d002/d087",
    "d000/d001/d002/d003/d088",
    "d000/d001/d002/d003/d004/d089",
    "d000/d001/d002/d003/d004/d005/d090",
    "d000/d001/d002/d003/d004/d005/d006/d091",
    "d000/d092",
    "d000/d001/d093",
    "d000/d001/d002/d094",
    "d000/d001/d002/d003/d095",
    "d000/d001/d002/d003/d004/d096",
    "d000/d001/d002/d003/d004/d005/d097",
    "d000/d001/d002/d003/d004/d005/d006/d098",
    "d000/d099",
    "d000/d001/d100",
    "d000/d001/d002/d101",
    "d000/d001/d002/d003/d102",
    "d000/d001/d002/d003/d004/d103",
    "d000/d001/d002/d003/d004/d005/d104"
  ],
  "files": [
    {
      "ordinal": 0,
      "path": "d000/f0000.bin",
      "sizeBytes": 1019,
      "contentSha256": "83780356cef69ee0b4d7724f4fad2f38ed66f7c3c2be8bd92affdbdf33dc148e"
    },
    {
      "ordinal": 1,
      "path": "d000/d001/d037/f0001.bin",
      "sizeBytes": 12199,
      "contentSha256": "5066bd6b465e60fc5aaa38a6f9cf82b73db0130f4c18929c08179d0ce78eddd7"
    },
    {
      "ordinal": 2,
      "path": "d000/d001/d002/d003/d074/f0002.bin",
      "sizeBytes": 13063,
      "contentSha256": "a5f8fcb14dbee70494e1b0acbc8edbe73e0da76268802e819e18480348ba38fe"
    },
    {
      "ordinal": 3,
      "path": "d000/d001/d002/d003/d004/d005/d006/f0003.bin",
      "sizeBytes": 841,
      "contentSha256": "12ea31bb3440526eb13952b8599202f0fe1ca0365cfc6ff4b90f919cd0dbc46e"
    },
    {
      "ordinal": 4,
      "path": "d000/d043/f0004.bin",
      "sizeBytes": 0,
      "contentSha256": "e3b0c44298fc1c149afbf4c8996fb92427ae41e4649b934ca495991b7852b855"
    },
    {
      "ordinal": 5,
      "path": "d000/d001/d002/d080/f0005.bin",
      "sizeBytes": 3024,
      "contentSha256": "a708bea8949f7d9fcfcbe8eb5754c13e61e4f286132084d85f92bbd969f2a492"
    },
    {
      "ordinal": 6,
      "path": "d000/d001/d002/d003/d004/d012/f0006.bin",
      "sizeBytes": 1792,
      "contentSha256": "5793e6554aa77099f0a8baea4c109c99b03f76dcf728e3e9da2b5041a633f7d6"
    },
    {
      "ordinal": 7,
      "path": "d000/d001/d002/d003/d004/d005/d006/d049/f0007.bin",
      "sizeBytes": 0,
      "contentSha256": "e3b0c44298fc1c149afbf4c8996fb92427ae41e4649b934ca495991b7852b855"
    },
    {
      "ordinal": 8,
      "path": "d000/d001/d086/f0008.bin",
      "sizeBytes": 3425,
      "contentSha256": "67ed69c6d0793de5c954e92e446539f55da22097c61b739507838e74f5810c04"
    },
    {
      "ordinal": 9,
      "path": "d000/d001/d002/d003/d018/f0009.bin",
      "sizeBytes": 1138,
      "contentSha256": "fde8f43deeb63132f6f06a011d4838491e46f5c84716963fdd1abb2341d80c67"
    },
    {
      "ordinal": 10,
      "path": "d000/d001/d002/d003/d004/d005/d055/f0010.bin",
      "sizeBytes": 6022,
      "contentSha256": "c86f104006b21b7a6c359a0d912506250cf6824e86a28fa56fb4754c703f316b"
    },
    {
      "ordinal": 11,
      "path": "d000/d092/f0011.bin",
      "sizeBytes": 3500,
      "contentSha256": "4ee8fd7e1fc338bbc50e052940461966b0b72382fb44de8791d82fb0e3d1a92f"
    },
    {
      "ordinal": 12,
      "path": "d000/d001/d002/d024/f0012.bin",
      "sizeBytes": 8214,
      "contentSha256": "33295196096f678b22ad7817798a1a283d88cf19c5ec1393d6f0a19fbb59e786"
    },
    {
      "ordinal": 13,
      "path": "d000/d001/d002/d003/d004/d061/f0013.bin",
      "sizeBytes": 2534,
      "contentSha256": "a6e185d9a680da4ae70fc0e6d4665d55f33818c059ddfb0f9becef6071d54718"
    },
    {
      "ordinal": 14,
      "path": "d000/d001/d002/d003/d004/d005/d006/d098/f0014.bin",
      "sizeBytes": 39211,
      "contentSha256": "da9f01a96f16fe0bf044b7fb6cb2fc1d9cb341c84dcb57db0eef7b13d8595cf2"
    },
    {
      "ordinal": 15,
      "path": "d000/d001/d030/f0015.bin",
      "sizeBytes": 1940,
      "contentSha256": "e12ff6919df06a1a2242053abef53c86586a69fd5df871feae4d2bc3362808de"
    },
    {
      "ordinal": 16,
      "path": "d000/d001/d002/d003/d067/f0016.bin",
      "sizeBytes": 18226,
      "contentSha256": "2f4ed8d05fb7a6d2fd5a4f128b8b292084b7b6d0270d1211ab162b76e1178dae"
    },
    {
      "ordinal": 17,
      "path": "d000/d001/d002/d003/d004/d005/d104/f0017.bin",
      "sizeBytes": 2118,
      "contentSha256": "26ee62db0123201976c0931462b7c2977cbae93edebfe6614616725cdc98f276"
    },
    {
      "ordinal": 18,
      "path": "d000/d036/f0018.bin",
      "sizeBytes": 0,
      "contentSha256": "e3b0c44298fc1c149afbf4c8996fb92427ae41e4649b934ca495991b7852b855"
    },
    {
      "ordinal": 19,
      "path": "d000/d001/d002/d073/f0019.bin",
      "sizeBytes": 36266,
      "contentSha256": "c4d4f92aec4aa84e0ac4486247b0a874c11e1ec871bbe1c505c0f5d31f223489"
    },
    {
      "ordinal": 20,
      "path": "d000/d001/d002/d003/d004/d005/f0020.bin",
      "sizeBytes": 3173,
      "contentSha256": "5c9f0c53b8f51d1824b141fe7b9a5dc0cd77b6ef573b7c7d18958016f786d57b"
    },
    {
      "ordinal": 21,
      "path": "d000/d001/d002/d003/d004/d005/d006/d042/f0021.bin",
      "sizeBytes": 19330,
      "contentSha256": "33b41106b74f32220258e7e1d4e74d01a2330fb273263581d72f7a82700a2f06"
    },
    {
      "ordinal": 22,
      "path": "d000/d001/d079/f0022.bin",
      "sizeBytes": 1272,
      "contentSha256": "d69adcf31efa8eeb0e0d0206780a854619223e07882a3509deb96db45286e458"
    },
    {
      "ordinal": 23,
      "path": "d000/d001/d002/d003/d011/f0023.bin",
      "sizeBytes": 588,
      "contentSha256": "5d79a94110e7a12125056cf4ac65dbbda422154016ecff91b2f64641d541a91b"
    },
    {
      "ordinal": 24,
      "path": "d000/d001/d002/d003/d004/d005/d048/f0024.bin",
      "sizeBytes": 7816,
      "contentSha256": "c7b0e4bc01220d294b6c8f35da0ad7c37324782a1fcad1f8de59b182240b6646"
    },
    {
      "ordinal": 25,
      "path": "d000/d085/f0025.bin",
      "sizeBytes": 574,
      "contentSha256": "49205cf061d54b72ec96d56702d398b1c1bf63464b09e4ee39b1d2be8a96a8f6"
    },
    {
      "ordinal": 26,
      "path": "d000/d001/d002/d017/f0026.bin",
      "sizeBytes": 12664,
      "contentSha256": "2f21b73cd8b0f478c6fdd04c900fc81981686d886cfcc25c864f189cb4d1b776"
    },
    {
      "ordinal": 27,
      "path": "d000/d001/d002/d003/d004/d054/f0027.bin",
      "sizeBytes": 29271,
      "contentSha256": "97247471fcb4a680b2d6400c254b7deaadf46d3aeb737251b4fdd4611989ff8f"
    },
    {
      "ordinal": 28,
      "path": "d000/d001/d002/d003/d004/d005/d006/d091/f0028.bin",
      "sizeBytes": 0,
      "contentSha256": "e3b0c44298fc1c149afbf4c8996fb92427ae41e4649b934ca495991b7852b855"
    },
    {
      "ordinal": 29,
      "path": "d000/d001/d023/f0029.bin",
      "sizeBytes": 811,